{
  "schema_version": 2,
  "lines": [
    {
      "page_number": 1,
      "text": "== Test Work - Part A",
      "ai_confidence_label": "high",
      "ai_notes": "",
      "line_box": {
        "ymin": 53,
        "xmin": 293,
        "ymax": 78,
        "xmax": 704
      }
    },
    {
      "page_number": 1,
      "text": "=== Page 1",
      "ai_confidence_label": "high",
      "ai_notes": "",
      "line_box": {
        "ymin": 112,
        "xmin": 80,
        "ymax": 139,
        "xmax": 201
      }
    },
    {
      "page_number": 1,
      "text": "This is part A, page 1 content for review-PDF generation testing.",
      "ai_confidence_label": "high",
      "ai_notes": "",
      "line_box": {
        "ymin": 155,
        "xmin": 79,
        "ymax": 172,
        "xmax": 615
      }
    },
    {
      "page_number": 2,
      "text": "== Page 2",
      "ai_confidence_label": "high",
      "ai_notes": "",
      "line_box": {
        "ymin": 49,
        "xmin": 79,
        "ymax": 77,
        "xmax": 201
      }
    },
    {
      "page_number": 2,
      "text": "This is part A, page 2 content for review-PDF generation testing.",
      "ai_confidence_label": "high",
      "ai_notes": "",
      "line_box": {
        "ymin": 93,
        "xmin": 79,
        "ymax": 109,
        "xmax": 615
      }
    },
    {
      "page_number": 3,
      "text": "== Page 3",
      "ai_confidence_label": "high",
      "ai_notes": "",
      "line_box": {
        "ymin": 49,
        "xmin": 79,
        "ymax": 77,
        "xmax": 201
      }
    },
    {
      "page_number": 3,
      "text": "This is part A, page 3 content for review-PDF generation testing.",
      "ai_confidence_label": "high",
      "ai_notes": "",
      "line_box": {
        "ymin": 93,
        "xmin": 79,
        "ymax": 109,
        "xmax": 615
      }
    }
  ],
  "confidence_score": 1.0,
  "confidence_label": "high",
  "model": "gemini/gemini-3.1-pro-preview",
  "configuration": "temperature=1.0, media_resolution=high, reasoning_effort=medium"
}
