{
  "schema_version": 2,
  "lines": [
    {
      "page_number": 1,
      "text": "This content serves as a test of",
      "ai_confidence_label": "high",
      "ai_notes": "",
      "line_box": {
        "ymin": 68,
        "xmin": 361,
        "ymax": 83,
        "xmax": 640
      }
    },
    {
      "page_number": 1,
      "text": "preserving line breaks in",
      "ai_confidence_label": "high",
      "ai_notes": "",
      "line_box": {
        "ymin": 86,
        "xmin": 361,
        "ymax": 100,
        "xmax": 640
      }
    },
    {
      "page_number": 1,
      "text": "paragraphs found in the original",
      "ai_confidence_label": "high",
      "ai_notes": "",
      "line_box": {
        "ymin": 102,
        "xmin": 363,
        "ymax": 117,
        "xmax": 639
      }
    },
    {
      "page_number": 1,
      "text": "text to be transcribed. Doing so",
      "ai_confidence_label": "high",
      "ai_notes": "",
      "line_box": {
        "ymin": 118,
        "xmin": 360,
        "ymax": 133,
        "xmax": 639
      }
    },
    {
      "page_number": 1,
      "text": "can aid in verifying the",
      "ai_confidence_label": "high",
      "ai_notes": "",
      "line_box": {
        "ymin": 132,
        "xmin": 358,
        "ymax": 151,
        "xmax": 639
      }
    },
    {
      "page_number": 1,
      "text": "transcription by person by having",
      "ai_confidence_label": "high",
      "ai_notes": "",
      "line_box": {
        "ymin": 152,
        "xmin": 363,
        "ymax": 165,
        "xmax": 637
      }
    },
    {
      "page_number": 1,
      "text": "the original in one window on the",
      "ai_confidence_label": "high",
      "ai_notes": "",
      "line_box": {
        "ymin": 167,
        "xmin": 361,
        "ymax": 182,
        "xmax": 637
      }
    },
    {
      "page_number": 1,
      "text": "computer monitor next to another",
      "ai_confidence_label": "high",
      "ai_notes": "",
      "line_box": {
        "ymin": 184,
        "xmin": 363,
        "ymax": 198,
        "xmax": 637
      }
    },
    {
      "page_number": 1,
      "text": "window with the transcription so",
      "ai_confidence_label": "high",
      "ai_notes": "",
      "line_box": {
        "ymin": 201,
        "xmin": 363,
        "ymax": 215,
        "xmax": 639
      }
    },
    {
      "page_number": 1,
      "text": "that each line in both windows",
      "ai_confidence_label": "high",
      "ai_notes": "",
      "line_box": {
        "ymin": 217,
        "xmin": 363,
        "ymax": 231,
        "xmax": 639
      }
    },
    {
      "page_number": 1,
      "text": "can be directly compared.",
      "ai_confidence_label": "high",
      "ai_notes": "",
      "line_box": {
        "ymin": 233,
        "xmin": 363,
        "ymax": 248,
        "xmax": 570
      }
    },
    {
      "page_number": 1,
      "text": "In addition, this content serves to",
      "ai_confidence_label": "high",
      "ai_notes": "",
      "line_box": {
        "ymin": 265,
        "xmin": 361,
        "ymax": 279,
        "xmax": 637
      }
    },
    {
      "page_number": 1,
      "text": "test that hyphenation is removed",
      "ai_confidence_label": "high",
      "ai_notes": "",
      "line_box": {
        "ymin": 282,
        "xmin": 361,
        "ymax": 297,
        "xmax": 639
      }
    },
    {
      "page_number": 1,
      "text": "as needed so that it no preservation",
      "ai_confidence_label": "high",
      "ai_notes": "Joined split word 'preservation' from next line",
      "line_box": {
        "ymin": 298,
        "xmin": 361,
        "ymax": 313,
        "xmax": 639
      }
    },
    {
      "page_number": 1,
      "text": "of the hyphen is done.",
      "ai_confidence_label": "high",
      "ai_notes": "Part of word moved to previous line",
      "line_box": {
        "ymin": 315,
        "xmin": 360,
        "ymax": 330,
        "xmax": 586
      }
    }
  ],
  "confidence_score": 1.0,
  "confidence_label": "high",
  "model": "gemini/gemini-3.1-pro-preview",
  "configuration": "temperature=1.0, media_resolution=high, reasoning_effort=medium"
}
